{
  "date": "2026-07-31",
  "tz": "America/New_York",
  "tf": "5m",
  "source": "synthetic",
  "bars": [
    [
      1785502800,
      20020,
      20021,
      20016.5,
      20017.5,
      497
    ],
    [
      1785503100,
      20017.5,
      20020.5,
      20016.5,
      20019.5,
      467
    ],
    [
      1785503400,
      20019.5,
      20020.5,
      20018,
      20019,
      560
    ],
    [
      1785503700,
      20019,
      20020,
      20016.25,
      20017.25,
      561
    ],
    [
      1785504000,
      20017.25,
      20018.25,
      20013,
      20014,
      699
    ],
    [
      1785504300,
      20014,
      20019,
      20013,
      20018,
      484
    ],
    [
      1785504600,
      20018,
      20019.75,
      20017.5,
      20019.25,
      565
    ],
    [
      1785504900,
      20019.25,
      20021.25,
      20018.75,
      20020.75,
      839
    ],
    [
      1785505200,
      20020.75,
      20022.5,
      20020.25,
      20022,
      376
    ],
    [
      1785505500,
      20022,
      20023.75,
      20021.5,
      20023.25,
      240
    ],
    [
      1785505800,
      20023.25,
      20025.25,
      20022.75,
      20024.75,
      868
    ],
    [
      1785506100,
      20024.75,
      20026.5,
      20024.25,
      20026,
      933
    ],
    [
      1785506400,
      20017.5,
      20018.5,
      20013.5,
      20014.5,
      777
    ],
    [
      1785506700,
      20014.5,
      20016.75,
      20013.5,
      20015.75,
      490
    ],
    [
      1785507000,
      20015.75,
      20016.75,
      20014.75,
      20015.75,
      780
    ],
    [
      1785507300,
      20015.75,
      20019.75,
      20014.75,
      20018.75,
      779
    ],
    [
      1785507600,
      20018.75,
      20022.25,
      20017.75,
      20021.25,
      706
    ],
    [
      1785507900,
      20021.25,
      20025.25,
      20020.25,
      20024.25,
      733
    ],
    [
      1785508200,
      20024.25,
      20024.75,
      20023.5,
      20024,
      896
    ],
    [
      1785508500,
      20024,
      20024.5,
      20023,
      20023.5,
      364
    ],
    [
      1785508800,
      20023.5,
      20024,
      20022.75,
      20023.25,
      173
    ],
    [
      1785509100,
      20023.25,
      20023.75,
      20022.5,
      20023,
      372
    ],
    [
      1785509400,
      20023,
      20023.5,
      20022,
      20022.5,
      395
    ],
    [
      1785509700,
      20022.5,
      20023,
      20021.75,
      20022.25,
      480
    ],
    [
      1785510000,
      20017.25,
      20018.25,
      20014,
      20015,
      279
    ],
    [
      1785510300,
      20015,
      20016,
      20014,
      20015,
      561
    ],
    [
      1785510600,
      20015,
      20017.75,
      20014,
      20016.75,
      709
    ],
    [
      1785510900,
      20016.75,
      20018.5,
      20015.75,
      20017.5,
      980
    ],
    [
      1785511200,
      20017.5,
      20018.5,
      20013.5,
      20014.5,
      778
    ],
    [
      1785511500,
      20014.5,
      20015.75,
      20013.5,
      20014.75,
      265
    ],
    [
      1785511800,
      20014.75,
      20015.25,
      20013.5,
      20014,
      873
    ],
    [
      1785512100,
      20014,
      20014.5,
      20013,
      20013.5,
      814
    ],
    [
      1785512400,
      20013.5,
      20014,
      20012.25,
      20012.75,
      481
    ],
    [
      1785512700,
      20012.75,
      20013.25,
      20011.5,
      20012,
      407
    ],
    [
      1785513000,
      20012,
      20012.5,
      20011,
      20011.5,
      504
    ],
    [
      1785513300,
      20011.5,
      20012,
      20010.25,
      20010.75,
      427
    ],
    [
      1785513600,
      20019.5,
      20021.25,
      20018.5,
      20020.25,
      141
    ],
    [
      1785513900,
      20020.25,
      20023.25,
      20019.25,
      20022.25,
      895
    ],
    [
      1785514200,
      20022.25,
      20026,
      20021.25,
      20025,
      673
    ],
    [
      1785514500,
      20025,
      20026,
      20021.5,
      20022.5,
      165
    ],
    [
      1785514800,
      20022.5,
      20024.75,
      20021.5,
      20023.75,
      752
    ],
    [
      1785515100,
      20023.75,
      20024.75,
      20020.75,
      20021.75,
      255
    ],
    [
      1785515400,
      20021.75,
      20022.75,
      20017.75,
      20018.75,
      101
    ],
    [
      1785515700,
      20018.75,
      20019.75,
      20014,
      20015,
      143
    ],
    [
      1785516000,
      20015,
      20019.75,
      20014,
      20018.75,
      818
    ],
    [
      1785516300,
      20018.75,
      20019.75,
      20014.5,
      20015.5,
      137
    ],
    [
      1785516600,
      20015.5,
      20016.5,
      20011.25,
      20012.25,
      931
    ],
    [
      1785516900,
      20012.25,
      20015.5,
      20011.25,
      20014.5,
      763
    ],
    [
      1785517200,
      20014.5,
      20016.75,
      20013.5,
      20015.75,
      250
    ],
    [
      1785517500,
      20015.75,
      20016.75,
      20013.25,
      20014.25,
      755
    ],
    [
      1785517800,
      20014.25,
      20015.25,
      20012,
      20013,
      629
    ],
    [
      1785518100,
      20013,
      20014.5,
      20012,
      20013.5,
      746
    ],
    [
      1785518400,
      20013.5,
      20014.5,
      20011.75,
      20012.75,
      259
    ],
    [
      1785518700,
      20012.75,
      20017.25,
      20011.75,
      20016.25,
      114
    ],
    [
      1785519000,
      20016.25,
      20020.25,
      20015.25,
      20019.25,
      431
    ],
    [
      1785519300,
      20019.25,
      20020.25,
      20015.75,
      20016.75,
      882
    ],
    [
      1785519600,
      20016.75,
      20021,
      20015.75,
      20020,
      385
    ],
    [
      1785519900,
      20020,
      20023.5,
      20019,
      20022.5,
      926
    ],
    [
      1785520200,
      20022.5,
      20025.5,
      20021.5,
      20024.5,
      722
    ],
    [
      1785520500,
      20024.5,
      20025.5,
      20019.75,
      20020.75,
      820
    ],
    [
      1785520800,
      20020.75,
      20021.75,
      20017.5,
      20018.5,
      542
    ],
    [
      1785521100,
      20018.5,
      20019.5,
      20016.5,
      20017.5,
      264
    ],
    [
      1785521400,
      20017.5,
      20020,
      20016.5,
      20019,
      793
    ],
    [
      1785521700,
      20019,
      20023,
      20018,
      20022,
      993
    ],
    [
      1785522000,
      20022,
      20023,
      20017.75,
      20018.75,
      528
    ],
    [
      1785522300,
      20018.75,
      20023.25,
      20017.75,
      20022.25,
      310
    ],
    [
      1785522600,
      20022.25,
      20023.25,
      20020.5,
      20021.5,
      699
    ],
    [
      1785522900,
      20021.5,
      20022.5,
      20018.75,
      20019.75,
      229
    ],
    [
      1785523200,
      20019.75,
      20020.75,
      20017.5,
      20018.5,
      248
    ],
    [
      1785523500,
      20018.5,
      20019.5,
      20014.25,
      20015.25,
      596
    ],
    [
      1785523800,
      20015.25,
      20016.25,
      20014,
      20015,
      855
    ],
    [
      1785524100,
      20015,
      20020,
      20014,
      20019,
      342
    ],
    [
      1785524400,
      20019,
      20020.25,
      20018,
      20019.25,
      974
    ],
    [
      1785524700,
      20019.25,
      20024,
      20018.25,
      20023,
      979
    ],
    [
      1785525000,
      20023,
      20025,
      20022,
      20024,
      216
    ],
    [
      1785525300,
      20024,
      20026.75,
      20023,
      20025.75,
      470
    ],
    [
      1785525600,
      20025.75,
      20026.75,
      20024.5,
      20025.5,
      522
    ],
    [
      1785525900,
      20025.5,
      20026.5,
      20023.5,
      20024.5,
      927
    ]
  ],
  "levels": [
    {
      "name": "ORH",
      "price": 20022.5,
      "from": 1785505200
    },
    {
      "name": "ORL",
      "price": 20017.5,
      "from": 1785505200
    }
  ],
  "windows": [
    {
      "name": "Opening range",
      "from": 1785504600,
      "to": 1785505500
    },
    {
      "name": "Entry window",
      "from": 1785505500,
      "to": 1785508200
    }
  ],
  "context": {
    "bias": "Synthetic",
    "trend_50d": "down",
    "fomc": false,
    "mode": "fixture"
  },
  "trades": [
    {
      "id": 4,
      "date": "2026-07-31",
      "setup": "orx",
      "side": "short",
      "grade": "A",
      "regime": "range",
      "opened": "2026-07-31T13:30:00.000Z",
      "closed": "2026-07-31T13:55:00.000Z",
      "entry": 20018,
      "stop": 20026,
      "t1": 20014,
      "final": 20002,
      "risk_pts": 8,
      "exit": 20026,
      "exit_reason": "stop",
      "t1_hit": false,
      "r": -1.0775,
      "pts": -8,
      "usd": -17.24,
      "mfe_pts": 0.5,
      "mae_pts": 8.5,
      "score": 60,
      "reasons": [
        "Synthetic signal for fixture testing; no trading rule was evaluated."
      ],
      "sample": "in"
    },
    {
      "id": 5,
      "date": "2026-07-31",
      "setup": "orx",
      "side": "long",
      "grade": "A",
      "regime": "range",
      "opened": "2026-07-31T14:30:00.000Z",
      "closed": "2026-07-31T14:55:00.000Z",
      "entry": 20024.25,
      "stop": 20016.25,
      "t1": 20028.25,
      "final": 20040.25,
      "risk_pts": 8,
      "exit": 20022.25,
      "exit_reason": "time",
      "t1_hit": false,
      "r": -0.3275,
      "pts": -2,
      "usd": -5.24,
      "mfe_pts": 0.5,
      "mae_pts": 2.5,
      "score": 70,
      "reasons": [
        "Synthetic signal for fixture testing; no trading rule was evaluated."
      ],
      "sample": "in"
    },
    {
      "id": 6,
      "date": "2026-07-31",
      "setup": "orx",
      "side": "short",
      "grade": "B",
      "regime": "range",
      "opened": "2026-07-31T15:30:00.000Z",